,pos,neutral,neg
savy drops to am,1,0,1
drops to am in,1,0,1
to am in will,1,0,1
am in will push,1,0,1
in will push investment,1,0,1
will push investment to,1,0,1
push investment to another,1,0,1
investment to another time,1,0,1
_url Daily chart though,1,0,0
Daily chart though RSI,1,0,0
chart though RSI and,1,0,0
though RSI and Stoch,1,0,0
RSI and Stoch point,1,0,0
and Stoch point at,1,0,0
Stoch point at possible,1,0,0
point at possible move,1,0,0
at possible move up,1,0,0
possible move up there,1,0,0
move up there is,1,0,0
up there is lot,1,0,0
there is lot of,1,0,0
is lot of resistance,1,0,0
What fear is they,0,0,1
fear is they let,0,0,1
is they let the,0,0,1
they let the stock,0,0,1
let the stock fall,0,0,1
the stock fall big,0,0,1
stock fall big time,0,0,1
fall big time after,0,0,1
big time after earnings,0,0,1
time after earnings then,0,0,1
after earnings then put,0,0,1
earnings then put lowball,0,0,1
then put lowball offer,0,0,1
put lowball offer in,0,0,1
not selling before CC,1,0,0
up in supermarket ready,1,0,0
in supermarket ready for,1,0,0
supermarket ready for lift,1,0,0
ready for lift off,1,0,0
now it is not,1,0,0
it is not manipulation,1,0,0
is not manipulation the,1,0,0
not manipulation the overall,1,0,0
manipulation the overall market,1,0,0
the overall market improve,1,0,0
overall market improve Apple,1,0,0
market improve Apple surely,1,0,0
improve Apple surely moves,1,0,0
Apple surely moves lot,1,0,0
surely moves lot with,1,0,0
moves lot with overall,1,0,0
lot with overall indicators,1,0,0
got some this morning,1,0,0
some this morning morning,1,0,0
this morning morning .,1,0,0
Erin Murphy of Piper,1,0,0
Murphy of Piper Jafray,1,0,0
of Piper Jafray thinks,1,0,0
Piper Jafray thinks is,1,0,0
Jafray thinks is BUY,1,0,0
thinks is BUY _url,1,0,0
looks like longer term,1,0,0
like longer term top,1,0,0
longer term top building,1,0,0
term top building which,1,0,0
top building which may,1,0,0
building which may take,1,0,0
which may take some,1,0,0
may take some time,1,0,0
take some time but,1,0,0
some time but here,1,0,0
time but here and,1,0,0
but here and now,1,0,0
here and now quickie,1,0,0
and now quickie short,1,0,0
now quickie short to,1,0,0
quickie short to fill,1,0,0
short to fill at,1,0,0
to fill at least,1,0,0
fill at least gap,1,0,0
looking good Just need,1,0,0
good Just need to,1,0,0
Just need to stay,1,0,0
need to stay as,1,0,0
to stay as support,1,0,0
stay as support Note,1,0,0
as support Note that,1,0,0
support Note that it,1,0,0
Note that it broke,1,0,0
that it broke this,1,0,0
it broke this area,1,0,0
broke this area on,1,0,0
this area on lighter,1,0,0
area on lighter volume,1,0,0
on lighter volume Not,1,0,0
lighter volume Not good,1,0,0
volume Not good sign,1,0,0
Not good sign but,1,0,0
good sign but it,1,0,0
sign but it is,1,0,0
but it is what,1,0,0
it is what it,1,0,0
is what it is,1,0,0
still an interesting finance,1,0,0
an interesting finance play,1,0,0
interesting finance play been,1,0,0
finance play been in,1,0,0
play been in this,1,0,0
been in this one,1,0,0
in this one since,1,0,0
this one since the,1,0,0
one since the s,1,0,0
since the s hold,1,0,0
Just broke the downtrend,1,0,0
broke the downtrend line,1,0,0
the downtrend line from,1,0,0
downtrend line from July,1,0,0
line from July and,1,0,0
from July and ready,1,0,0
July and ready to,1,0,0
and ready to launch,1,0,0
ready to launch through,1,0,0
to launch through the,1,0,0
launch through the day,1,0,0
through the day moving,1,0,0
the day moving average,1,0,1
some of the stocks,2,0,0
of the stocks that,2,0,0
the stocks that came,2,0,0
stocks that came up,2,0,0
that came up on,2,0,0
came up on screens,2,0,0
up on screens for,2,0,0
on screens for longs,2,0,0
soars pre-market on business,3,0,0
pre-market on business split,3,0,0
on business split announcement,3,0,0
business split announcement rumors,3,0,0
split announcement rumors looking,3,0,0
announcement rumors looking to,3,0,0
rumors looking to she,3,0,0
looking to she would,3,0,0
to she would stake,3,0,0
she would stake with,3,0,0
would stake with buyer,3,0,0
stake with buyer LOL,3,0,0
downgrade is bias This,1,0,0
is bias This stock,1,0,0
bias This stock is,1,0,0
This stock is buy,1,0,0
is not crazy Indexes,1,0,0
not crazy Indexes are,1,0,0
crazy Indexes are engineered,1,0,0
Indexes are engineered you,1,0,0
are engineered you ut,1,0,0
engineered you ut little,1,0,0
you ut little confidence,1,0,0
ut little confidence in,1,0,0
little confidence in prev,1,0,0
confidence in prev hi,1,0,0
in prev hi beta,1,0,0
prev hi beta hi,1,0,0
hi beta hi performers,1,0,0
beta hi performers _url,1,0,0
in trouble is that,0,0,1
trouble is that earnings,0,0,1
is that earnings gap,0,0,1
that earnings gap still,0,0,1
earnings gap still unfilled,0,0,1
bull move ended waiting,0,0,1
move ended waiting for,0,0,1
ended waiting for next,0,0,1
waiting for next setup,0,0,1
and trying to lead,2,0,0
trying to lead higher,2,0,0
to lead higher here,2,0,0
lead higher here going,2,0,0
higher here going to,2,0,0
here going to be,2,0,0
going to be tough,2,0,0
more praise bad bad,1,0,0
praise bad bad bad,1,0,0
bad bad bad RT,1,0,0
bad bad RT RT,1,0,0
bad RT RT bought,1,0,0
RT RT bought back,1,0,0
RT bought back more,1,0,0
bought back more shares,1,0,0
back more shares here,1,0,0
more shares here today,1,0,0
shares here today god,1,0,0
here today god for,1,0,0
today god for you,1,0,0
god for you am,1,0,0
for you am riding,1,0,0
you am riding with,1,0,0
am riding with ya,1,0,0
sold xoma will buy,0,0,1
xoma will buy back,0,0,1
will buy back on,0,0,1
buy back on April,0,0,1
do not catch falling,1,0,0
not catch falling knives,1,0,0
catch falling knives but,1,0,0
falling knives but think,1,0,0
knives but think an,1,0,0
but think an entry,1,0,0
think an entry is,1,0,0
an entry is coming,1,0,0
entry is coming soon,1,0,0
is coming soon on,1,0,0
coming soon on this,1,0,0
and short put positions,0,0,1
short put positions looking,0,0,1
put positions looking good,0,0,1
positions looking good here,0,0,1
looking good here Wait,0,0,1
good here Wait for,0,0,1
here Wait for market,0,0,1
Wait for market downturn,0,0,1
for market downturn to,0,0,1
market downturn to confirm,0,0,1
Institutions seem to like,2,0,0
seem to like this,2,0,0
to like this class,2,0,0
like this class of,2,0,0
this class of stocks,2,0,0
class of stocks Own,2,0,0
of stocks Own of,2,0,0
stocks Own of shares,2,0,0
Own of shares in,2,0,0
of shares in DVR,2,0,0
got hit hard lower,0,0,1
hit hard lower this,0,0,1
hard lower this AM,0,0,1
lower this AM -->,0,0,1
this AM --> looks,0,0,1
AM --> looks like,0,0,1
--> looks like it,0,0,1
looks like it has,0,0,1
like it has found,0,0,1
it has found support,0,0,1
has found support _url,0,0,1
bigies must be loading,1,0,0
must be loading up,1,0,0
be loading up here,1,0,0
loading up here at,1,0,0
up here at lows,1,0,0
wkly Inverse Head and,1,0,0
Inverse Head and Shoulders,1,0,0
Head and Shoulders forming,1,0,0
and Shoulders forming triggers,1,0,0
Shoulders forming triggers over,1,0,0
forming triggers over PO,1,0,0
triggers over PO at,1,0,0
over PO at least,1,0,0
PO at least watching,1,0,0
at least watching _url,1,0,0
Weird day up down,1,0,0
Embarrassing China numbers Imagine,0,0,1
China numbers Imagine Facebok,0,0,1
numbers Imagine Facebok going,0,0,1
Imagine Facebok going to,0,0,1
Facebok going to China,0,0,1
going to China and,0,0,1
to China and signing,0,0,1
China and signing up,0,0,1
and signing up only,0,0,1
signing up only million,0,0,1
up only million users,0,0,1
only million users Same,0,0,1
million users Same expectations,0,0,1
_url Possible target at,1,0,0
Possible target at around,1,0,0
target at around Neckline,1,0,0
at around Neckline Fork,1,0,0
around Neckline Fork congestion,1,0,0
_url Long setup Closed,1,0,0
Long setup Closed above,1,0,0
setup Closed above the,1,0,0
Closed above the MACD,1,0,0
above the MACD cross,1,0,0
the MACD cross November,1,0,0
MACD cross November catalyst,1,0,0
CLOSED GREN BULLISH Lol,1,0,0
bumping its head on,0,0,1
its head on declining,0,0,1
head on declining daily,0,0,1
on declining daily as,0,0,1
declining daily as overhead,0,0,1
daily as overhead resistance,0,0,1
as overhead resistance Then,0,0,1
overhead resistance Then the,0,0,1
resistance Then the big,0,0,1
Then the big brother,0,0,1
the big brother just,0,0,1
big brother just above,0,0,1
brother just above that,0,0,1
At least you did,0,0,1
least you did not,0,0,1
you did not stop,0,0,1
did not stop out,0,0,1
not stop out at,0,0,1
stop out at like,0,0,1
out at like me,0,0,1
at like me me,0,0,1
like me me :(,0,0,1
hopefully people shorting for,0,0,1
people shorting for scalps,0,0,1
shorting for scalps not,0,0,1
for scalps not good,0,0,1
scalps not good swing,0,0,1
not good swing as,0,0,1
good swing as this,0,0,1
swing as this is,0,0,1
as this is day,0,0,1
this is day run,0,0,1
keep stock on your,1,0,0
stock on your watch,1,0,0
on your watch list,1,0,0
your watch list not,1,0,0
watch list not doing,1,0,0
list not doing much,1,0,0
not doing much because,1,0,0
doing much because down,1,0,0
much because down tape,1,0,0
because down tape Very,1,0,0
down tape Very strange,1,0,0
tape Very strange buying,1,0,0
Very strange buying today,1,0,0
now over AH gap,1,0,0
over AH gap up,1,0,0
AH gap up tomorrow,1,0,0
Is it just me,1,0,0
it just me or,1,0,0
just me or does,1,0,0
me or does it,1,0,0
or does it seem,1,0,0
does it seem is,1,0,0
it seem is long,1,0,0
seem is long the,1,0,0
is long the market,1,0,0
long the market from,1,0,0
the market from these,1,0,0
market from these comments,1,0,0
from these comments LOL,1,0,0
these comments LOL Was,1,0,0
comments LOL Was thinking,1,0,0
LOL Was thinking the,1,0,0
Was thinking the same,1,0,0
thinking the same same,1,0,0
the same same .,1,0,0
acting tough on big,1,0,0
tough on big volume,1,0,0
on big volume against,1,0,0
big volume against the,1,0,0
volume against the tape,1,0,0
Weekly calls now _url,1,0,0
has been bull and,0,1,0
been bull and bear,0,1,0
bull and bear any,0,1,0
and bear any way,0,1,0
bear any way you,0,1,0
any way you cut,0,1,0
way you cut it,0,1,0
would consider this opportunity,1,0,0
consider this opportunity to,1,0,0
this opportunity to add,1,0,0
opportunity to add my,1,0,0
to add my position,1,0,0
add my position because,1,0,0
my position because the,1,0,0
position because the company,1,0,0
because the company is,1,0,0
the company is on,1,0,0
company is on the,1,0,0
is on the right,1,0,0
on the right track,1,0,0
the right track they,1,0,0
right track they are,1,0,0
track they are still,1,0,0
they are still improving,1,0,0
are still improving sales,1,0,0
still improving sales sales,1,0,0
improving sales sales .,1,0,0
Yes buy everything up,1,0,0
buy everything up World,1,0,0
everything up World is,1,0,0
up World is fine,1,0,0
Brent back below what,0,0,1
back below what is,0,0,1
below what is WTI,0,0,1
what is WTI doing,0,0,1
is WTI doing above,0,0,1
WTI doing above hahaha,0,0,1
doing above hahaha yes,0,0,1
above hahaha yes it,0,0,1
hahaha yes it will,0,0,1
yes it will go,0,0,1
it will go s,0,0,1
will go s again,0,0,1
go s again very,0,0,1
s again very soon,0,0,1
Top Upstream MLP ranked,1,0,0
Upstream MLP ranked by,1,0,0
MLP ranked by estimated,1,0,0
ranked by estimated year,1,0,0
by estimated year forward,1,0,0
estimated year forward yield,1,0,0
year forward yield after,1,0,0
forward yield after tax,1,0,0
yield after tax undiscounted,1,0,0
after tax undiscounted long,1,0,0
tax undiscounted long BBEP,1,0,0
Looks like might break,0,0,1
like might break down,0,0,1
might break down am,0,0,1
break down am out,0,0,1
_url Like this for,1,0,0
Like this for trade,1,0,0
this for trade to,1,0,0
for trade to sma,1,0,0
trade to sma fib,1,0,0
to sma fib from,1,0,0
sma fib from month,1,0,0
fib from month range,1,0,0
from month range short,1,0,0
month range short int,1,0,0
range short int reports,1,0,0
CHUNK OF DEC PUTS,0,0,1
OF DEC PUTS BOUGHT,0,0,1
DEC PUTS BOUGHT AT,0,0,1
PUTS BOUGHT AT ¢,0,0,1
BOUGHT AT ¢ OPENING,0,0,1
No it is Not,0,0,2
it is Not Time,0,0,2
is Not Time To,0,0,2
Not Time To Buy,0,0,2
Time To Buy Energy,0,0,2
To Buy Energy Stocks,0,0,2
Buy Energy Stocks Yet,0,0,2
Energy Stocks Yet _url,0,0,2
should be coming very,1,0,0
be coming very quick,1,0,0
coming very quick if,1,0,0
very quick if the,1,0,0
quick if the FED,1,0,0
if the FED supports,1,0,0
the FED supports the,1,0,0
FED supports the markets,1,0,0
true but short the,0,0,1
but short the market,0,0,1
short the market using,0,0,1
the market using plenty,0,0,1
market using plenty of,0,0,1
using plenty of reverse,0,0,1
plenty of reverse ETF's,0,0,1
of reverse ETF's should,0,0,1
reverse ETF's should be,0,0,1
ETF's should be the,0,0,1
should be the alternative,0,0,1
be the alternative rather,0,0,1
the alternative rather than,0,0,1
alternative rather than bubble,0,0,1
rather than bubble creation,0,0,1
Over with conviction and,1,0,0
with conviction and am,1,0,0
conviction and am buyer,1,0,0
and am buyer good,1,0,0
am buyer good for,1,0,0
buyer good for ride,1,0,0
good for ride to,1,0,0
Some competitors worry that,1,0,0
competitors worry that BlackBerry,1,0,0
worry that BlackBerry is,1,0,0
that BlackBerry is the,1,0,0
BlackBerry is the inevitable,1,0,0
is the inevitable successor,1,0,0
the inevitable successor to,1,0,0
inevitable successor to Northern,1,0,0
successor to Northern Telecom,1,0,0
to Northern Telecom ut,1,0,0
Northern Telecom ut with,1,0,0
Telecom ut with much,1,0,0
ut with much more,1,0,0
with much more competent,1,0,0
much more competent leadership,1,0,0
ICYMI shorts only _url,0,0,1
come on go UP,0,0,1
on go UP tired,0,0,1
go UP tired of,0,0,1
UP tired of seeing,0,0,1
tired of seeing this,0,0,1
of seeing this go,0,0,1
seeing this go down,0,0,1
ascending base breakout starting,1,0,0
base breakout starting to,1,0,0
breakout starting to gain,1,0,0
starting to gain traction,1,0,0
to gain traction strong,1,0,0
gain traction strong stock,1,0,0
traction strong stock _url,1,0,0
as much as would,0,0,1
much as would like,0,0,1
as would like to,0,0,1
would like to capture,0,0,1
like to capture back,0,0,1
to capture back market,0,0,1
capture back market share,0,0,1
back market share clearly,0,0,1
market share clearly surpassed,0,0,1
share clearly surpassed their,0,0,1
clearly surpassed their BB,0,0,1
surpassed their BB for,0,0,1
their BB for all,0,0,1
BB for all too,0,0,1
for all too long,0,0,1
all too long of,0,0,1
too long of time,0,0,1
long of time ka,0,0,1
of time ka Android,0,0,1
Rowan Expands Share Repurchase,1,0,0
Expands Share Repurchase Program,1,0,0
Share Repurchase Program to,1,0,0
Repurchase Program to million,1,0,0
It may be risky,1,0,0
may be risky but,1,0,0
be risky but its,1,0,0
risky but its rush,1,0,0
but its rush will,1,0,0
its rush will give,1,0,0
rush will give you,1,0,0
will give you that,1,0,0
give you that Just,1,0,0
you that Just make,1,0,0
that Just make sure,1,0,0
Just make sure you,1,0,0
make sure you do,1,0,0
sure you do not,1,0,0
you do not go,1,0,0
do not go long,1,0,0
not go long with,1,0,0
go long with all,1,0,0
long with all your,1,0,0
with all your money,1,0,0
all your money Play,1,0,0
your money Play safe,1,0,0
money Play safe be,1,0,0
Play safe be long,1,0,0
yeah Even is looking,2,0,0
Even is looking pretty,2,0,0
is looking pretty attractive,2,0,0
looking pretty attractive versus,2,0,0
pretty attractive versus this,2,0,0
attractive versus this pig,2,0,0
versus this pig Or,2,0,0
this pig Or the,2,0,0
pig Or the SOX,2,0,0
Or the SOX trading,2,0,0
the SOX trading reported,2,0,0
SOX trading reported earning,2,0,0
Closed short position Small,1,0,0
short position Small gain,1,0,0
position Small gain Not,1,0,0
Small gain Not interested,1,0,0
gain Not interested in,1,0,0
Not interested in options,1,0,0
interested in options expiring,1,0,0
in options expiring worthless,1,0,0
and holding up well,2,0,0
holding up well today,2,0,0
gapping up to all,1,0,0
up to all time,1,0,0
to all time highs,2,0,0
all time highs _url,1,0,0
time highs _url _url,1,0,0
revenue in the range,0,0,1
in the range of,0,0,1
the range of million,0,0,1
range of million to,0,0,1
of million to million,0,0,1
million to million not,0,0,1
to million not good,0,0,1
or is it the,1,0,0
is it the train,1,0,0
it the train to,1,0,0
the train to the,1,0,0
train to the cellar,1,0,0
to the cellar this,1,0,0
the cellar this is,1,0,0
cellar this is what,1,0,0
this is what bottom,1,0,0
is what bottom looks,1,0,0
what bottom looks like,1,0,0
bottom looks like confirmation,1,0,0
looks like confirmation is,1,0,0
like confirmation is hold,1,0,0
confirmation is hold above,1,0,0
bye bye Samy Hello,1,0,0
bye Samy Hello BB,1,0,0
Samy Hello BB Sounds,1,0,0
Hello BB Sounds like,1,0,0
BB Sounds like we,1,0,0
Sounds like we will,1,0,0
like we will see,1,0,0
we will see some,1,0,0
will see some green,1,0,0
see some green tomorrow,1,0,0
Beautiful trend base all,1,0,0
trend base all technicals,1,0,0
base all technicals pointing,1,0,0
all technicals pointing up,1,0,0
technicals pointing up Solid,1,0,0
pointing up Solid accumulation,1,0,0
up Solid accumulation Looks,1,0,0
Solid accumulation Looks good,1,0,0
accumulation Looks good Weekly,1,0,0
Looks good Weekly next,1,0,0
good Weekly next _url,1,0,0
heading back down to,0,0,1
back down to that,0,0,1
down to that region,0,0,1
to that region really,0,0,1
that region really needs,0,0,1
region really needs to,0,0,1
really needs to hold,0,0,1
needs to hold the,0,0,1
to hold the s,0,0,1
hold the s Not,0,0,1
the s Not sure,0,0,1
s Not sure where,0,0,1
Not sure where this,0,0,1
sure where this goes,0,0,1
where this goes from,0,0,1
this goes from here,0,0,1
goes from here without,0,0,1
from here without news,0,0,1
here without news news,0,0,1
without news news .,0,0,1
congress probably long and,1,0,0
probably long and because,1,0,0
long and because they,1,0,0
and because they f,1,0,0
because they f cking,1,0,0
they f cking can,1,0,0
f cking can right,1,0,0
will be buying my,0,0,2
be buying my last,0,0,2
buying my last round,0,0,2
my last round of,0,0,2
last round of shorts,0,0,2
round of shorts next,0,0,2
of shorts next week,0,0,2
shorts next week bring,0,0,2
next week bring the,0,0,2
week bring the average,0,0,2
bring the average down,0,0,2
the average down its,0,0,2
average down its all,0,0,2
down its all bought,0,0,2
its all bought ladders,0,0,2
all bought ladders and,0,0,2
bought ladders and triplying,0,0,2
ladders and triplying down,0,0,2
This stock is such,1,0,0
stock is such winner,1,0,0
only those with the,0,0,1
those with the stomach,0,0,1
with the stomach for,0,0,1
the stomach for high,0,0,1
stomach for high risk,0,0,1
for high risk are,0,0,1
high risk are left,0,0,1
risk are left and,0,0,1
are left and that,0,0,1
left and that is,0,0,1
and that is extremely,0,0,1
that is extremely sensitive,0,0,1
is extremely sensitive to,0,0,1
extremely sensitive to nasdaq,0,0,1
for was still up,1,0,0
was still up on,1,0,0
still up on the,1,0,0
up on the screen,1,0,0
on the screen _url,1,0,0
some upside today This,1,0,0
upside today This thing,1,0,0
today This thing is,1,0,0
This thing is severe,1,0,0
thing is severe low,1,0,0
is severe low float,1,0,0
severe low float If,1,0,0
low float If there,1,0,0
float If there is,1,0,0
If there is catalyst,1,0,0
there is catalyst for,1,0,0
is catalyst for this,1,0,0
catalyst for this guy,1,0,0
for this guy It,1,0,0
this guy It can,1,0,0
guy It can run,1,0,0
shorts made killing last,0,0,1
made killing last couple,0,0,1
killing last couple days,0,0,1
last couple days might,0,0,1
couple days might make,0,0,1
days might make more,0,0,1
might make more if,0,0,1
make more if cover,0,0,1
more if cover and,0,0,1
if cover and buy,0,0,1
cover and buy back,0,0,1
has the stuff Will,1,0,0
the stuff Will be,1,0,0
stuff Will be looking,1,0,0
Will be looking to,1,0,0
be looking to add,1,0,0
looking to add shares,1,0,0
to add shares if,1,0,0
add shares if we,1,0,0
shares if we get,1,0,0
if we get new,1,0,0
we get new high,1,0,0
get new high breakout,1,0,0
are watching SPY minute,0,0,1
watching SPY minute STO,0,0,1
SPY minute STO for,0,0,1
minute STO for push,0,0,1
STO for push note,0,0,1
for push note price,0,0,1
push note price on,0,0,1
note price on the,0,0,1
price on the no,0,0,1
on the no rush,0,0,1
the no rush wait,0,0,1
no rush wait for,0,0,1
rush wait for buyers,0,0,1
Systems D Stock Receives,0,0,1
D Stock Receives Ratings,0,0,1
Stock Receives Ratings Downgrade,0,0,1
Receives Ratings Downgrade Today,0,0,1
Ratings Downgrade Today at,0,0,1
Downgrade Today at Jeferies,0,0,1
Today at Jeferies _url,0,0,1
Looks weak now bottom,0,0,1
weak now bottom is,0,0,1
now bottom is not,0,0,1
bottom is not yet,0,0,1
is not yet over,0,0,1
not yet over May,0,0,1
yet over May be,0,0,1
over May be around,0,0,1
May be around levels,0,0,1
be around levels we,0,0,1
around levels we can,0,0,1
levels we can see,0,0,1
we can see it,0,0,1
can see it Stay,0,0,1
see it Stay Short,0,0,1
it Stay Short in,0,0,1
Stay Short in SPY,0,0,1
Short in SPY till,0,0,1
in SPY till then,0,0,1
small pos short wkly,0,0,1
pos short wkly puts,0,0,1
_url On closer inspection,0,0,1
On closer inspection Resistance,0,0,1
closer inspection Resistance points,0,0,1
inspection Resistance points north,0,0,1
Resistance points north at,0,0,1
points north at and,0,0,1
north at and downward,0,0,1
at and downward trendline,0,0,1
and downward trendline Chart,0,0,1
downward trendline Chart of,0,0,1
lol RIP then :),0,0,1
RIP then :) RT,0,0,1
then :) RT Even,0,0,1
:) RT Even at,0,0,1
RT Even at these,0,0,1
Even at these levels,0,0,1
at these levels is,0,0,1
these levels is not,0,0,1
levels is not cheap,0,0,1
is not cheap Wake,0,0,1
not cheap Wake me,0,0,1
cheap Wake me up,0,0,1
Wake me up when,0,0,1
me up when it,0,0,1
up when it is,0,0,1
when it is in,0,0,1
it is in the,0,0,1
is in the then,0,0,1
in the then it,0,0,1
the then it is,0,0,1
then it is worth,0,0,1
it is worth look,0,0,1
they have real assets,1,0,0
have real assets and,1,0,0
real assets and are,1,0,0
assets and are NOT,1,0,0
and are NOT an,1,0,0
are NOT an energy,1,0,0
NOT an energy trading,1,0,0
an energy trading company,1,0,0
Google Inc completes acquisition,1,0,0
Inc completes acquisition of,1,0,0
completes acquisition of ICOA,1,0,0
acquisition of ICOA Inc,1,0,0
of ICOA Inc _url,1,0,0
Looking for continuation with,1,0,0
for continuation with volume,1,0,0
continuation with volume increase,1,0,0
with volume increase _url,1,0,0
another view of actively,0,0,1
view of actively Head,0,0,1
of actively Head Shoulder,0,0,1
actively Head Shoulder in,0,0,1
Head Shoulder in progress,0,0,1
Shoulder in progress on,0,0,1
in progress on chart,0,0,1
progress on chart _url,0,0,1
Gold Miners Bullish Percent,0,2,0
Miners Bullish Percent Index,0,2,0
Bullish Percent Index Weekly,0,2,0
Percent Index Weekly _url,0,2,0
both reporting today should,1,0,0
reporting today should reward,1,0,0
today should reward better,1,0,0
should reward better on,1,0,0
reward better on good,1,0,0
better on good earnings,1,0,0
on good earnings as,1,0,0
good earnings as it,1,0,0
earnings as it sold,1,0,0
as it sold of,1,0,0
it sold of in,1,0,0
sold of in last,1,0,0
of in last two,1,0,0
in last two days,1,0,0
last two days yet,1,0,0
two days yet rallied,1,0,0
In play tmrw Watch,1,0,0
play tmrw Watch Housing,1,0,0
tmrw Watch Housing Sector,1,0,0
is now beaten down,0,0,1
now beaten down hated,0,0,1
beaten down hated etc,0,0,1
down hated etc hm,0,0,1
hated etc hm opposite,0,0,1
etc hm opposite of,0,0,1
hm opposite of what,0,0,1
opposite of what happens,0,0,1
of what happens next,0,0,1
shares up after hours,1,0,0
up after hours EPS,1,0,0
after hours EPS beats,1,0,0
hours EPS beats by,1,0,0
EPS beats by sees,1,0,0
beats by sees adj-EPS,1,0,0
by sees adj-EPS vs,1,0,0
sees adj-EPS vs cons,1,0,0
adj-EPS vs cons sales,1,0,0
vs cons sales vs,1,0,0
cons sales vs cons,1,0,0
seriously nothing says strong,1,0,0
nothing says strong growth,1,0,0
says strong growth like,1,0,0
strong growth like and,1,0,0
growth like and well,1,0,0
like and well played,1,0,0
Why not sell credit,1,0,0
not sell credit spread,1,0,0
sell credit spread may,1,0,0
credit spread may do,1,0,0
spread may do one,1,0,0
may do one at,1,0,0
do one at the,1,0,0
one at the money,1,0,0
at the money Call,1,0,0
the money Call credit,1,0,0
money Call credit spread,1,0,0
Call credit spread on,1,0,0
they are hitting everything,0,0,1
are hitting everything in,0,0,1
hitting everything in sight,0,0,1
everything in sight hort,0,0,1
in sight hort it,0,0,1
sight hort it but,0,0,1
hort it but twtr,0,0,1
being pushed up by,0,0,1
pushed up by few,0,0,1
up by few jack,0,0,1
by few jack monkey's,0,0,1
few jack monkey's This,0,0,1
jack monkey's This thing,0,0,1
monkey's This thing will,0,0,1
This thing will short,0,0,1
thing will short to,0,0,1
will short to soon,0,0,1
short to soon going,0,0,1
to soon going to,0,0,1
soon going to add,0,0,1
going to add sedond,0,0,1
to add sedond short,0,0,1
add sedond short somewhere,0,0,1
sedond short somewhere in,0,0,1
short somewhere in the,0,0,1
somewhere in the high,0,0,1
in the high s,0,0,1
the high s if,0,0,1
high s if we,0,0,1
s if we get,0,0,1
Yep they lowered target,0,0,1
they lowered target to,0,0,1
lowered target to only,0,0,1
target to only gain,0,0,1
to only gain from,0,0,1
only gain from these,0,0,1
gain from these levels,0,0,1
_url Bounced off support,1,0,0
Bounced off support early,1,0,0
off support early in,1,0,0
support early in week,1,0,0
early in week now,1,0,0
in week now indicators,1,0,0
week now indicators turning,1,0,0
now indicators turning up,1,0,0
indicators turning up RSI,1,0,0
turning up RSI MACD,1,0,0
up RSI MACD SMI,1,0,0
RSI MACD SMI Worth,1,0,0
MACD SMI Worth look,1,0,0
great company data breakout,1,0,0
company data breakout from,1,0,0
data breakout from apple,1,0,0
breakout from apple investor,1,0,0
from apple investor relations,1,0,0
apple investor relations _url,1,0,0
under right here also,1,0,0
right here also looks,1,0,0
here also looks like,1,0,0
also looks like nice,1,0,0
looks like nice risk,1,0,0
like nice risk reward,1,0,0
