,pos,neutral,neg
cap tech is finally,1,0,0
tech is finally trying,1,0,0
is finally trying to,1,0,0
finally trying to catch,1,0,0
trying to catch up,1,0,0
to catch up with,1,0,0
catch up with the,1,0,0
up with the rest,1,0,0
with the rest of,1,0,0
the rest of the,1,0,0
rest of the market,1,0,0
very weak res at,0,0,1
weak res at .,0,0,1
gap up today maybe,2,0,0
up today maybe they,2,0,0
today maybe they say,2,0,0
maybe they say the,2,0,0
they say the heat,2,0,0
say the heat is,2,0,0
the heat is coming,2,0,0
heat is coming _url,2,0,0
turning Coming from far,1,0,0
Coming from far could,1,0,0
from far could go,1,0,0
far could go far,1,0,0
could go far Stock,1,0,0
go far Stock price,1,0,0
far Stock price implies,1,0,0
Stock price implies you,1,0,0
price implies you pay,1,0,0
implies you pay nothing,1,0,0
you pay nothing for,1,0,0
pay nothing for the,1,0,0
nothing for the business,1,0,0
moves better with oil,1,0,0
better with oil anyways,1,0,0
with oil anyways oil,1,0,0
oil anyways oil back,1,0,0
anyways oil back above,1,0,0
The gist of downgrades,0,0,1
gist of downgrades was,0,0,1
of downgrades was apple,0,0,1
downgrades was apple failed,0,0,1
was apple failed to,0,0,1
apple failed to make,0,0,1
failed to make phone,0,0,1
to make phone that,0,0,1
make phone that will,0,0,1
phone that will help,0,0,1
that will help supercharge,0,0,1
will help supercharge growth,0,0,1
help supercharge growth in,0,0,1
supercharge growth in China,0,0,1
growth in China what,0,0,1
in China what if,0,0,1
China what if they,0,0,1
what if they were,0,0,1
if they were right,0,0,1
they were right um,0,0,1
Another gain in following,1,0,0
gain in following last,1,0,0
in following last wek's,1,0,0
following last wek's huge,1,0,0
last wek's huge call,1,0,0
wek's huge call buying,1,0,0
huge call buying in,1,0,0
call buying in the,1,0,0
buying in the april,1,0,0
in the april calls,1,0,0
having much better day,0,0,1
much better day than,0,0,1
industrial-gods stocks insiders are,5,0,0
stocks insiders are bullish,5,0,0
insiders are bullish on,5,0,0
are bullish on _url,5,0,0
You have to love,0,0,1
have to love these,0,0,1
to love these types,0,0,1
love these types of,0,0,1
these types of articles,0,0,1
types of articles SS,0,0,1
of articles SS interest,0,0,1
articles SS interest rose,0,0,1
SS interest rose on,0,0,1
interest rose on on,0,0,1
rose on on day,0,0,1
on on day before,0,0,1
on day before we,0,0,1
day before we hit,0,0,1
before we hit our,0,0,1
we hit our lows,0,0,1
hit our lows _url,0,0,1
now March puts now,0,0,1
March puts now hod,0,0,1
puts now hod _url,0,0,1
gap fill coming up,1,0,0
BTW when there is,1,0,0
when there is turmoil,1,0,0
there is turmoil in,1,0,0
is turmoil in the,1,0,0
turmoil in the MENA,1,0,0
in the MENA region,1,0,0
the MENA region shippers,1,0,0
MENA region shippers perform,1,0,0
region shippers perform same,1,0,0
shippers perform same as,1,0,0
perform same as oil,1,0,0
same as oil performs,1,0,0
as oil performs with,1,0,0
oil performs with the,1,0,0
performs with the same,1,0,0
with the same turmoil,1,0,0
Bet the farm on,1,0,0
the farm on hopeful,1,0,0
farm on hopeful for,1,0,0
on hopeful for good,1,0,0
hopeful for good things,1,0,0
for good things soon,1,0,0
the parties over loaded,0,0,3
parties over loaded on,0,0,3
over loaded on volatility,0,0,3
loaded on volatility is,0,0,3
on volatility is back,0,0,3
is looking weak while,0,0,1
looking weak while this,0,0,1
weak while this market,0,0,1
while this market is,0,0,1
this market is moving,0,0,1
market is moving higher,0,0,1
is moving higher not,0,0,1
moving higher not good,0,0,1
higher not good sign,0,0,1
not good sign Unles,0,0,1
good sign Unles can,0,0,1
sign Unles can get,0,0,1
Unles can get above,0,0,1
can get above early,0,0,1
get above early short,0,0,1
above early short below,0,0,1
early short below today,0,0,1
top stocks on NASDAQ,2,0,0
stocks on NASDAQ _url,2,0,0
globally this week on,1,0,0
this week on avengers,1,0,0
week on avengers really,1,0,0
on avengers really sick,1,0,0
avengers really sick tan,1,0,0
really sick tan lee,1,0,0
sick tan lee is,1,0,0
tan lee is beast,1,0,0
Bufet's Shows New Stakes,2,0,0
Shows New Stakes in,2,0,0
New Stakes in CVS,2,0,0
Stakes in CVS Visa,2,0,0
in CVS Visa General,2,0,0
CVS Visa General Dynamics,2,0,0
idk but seems to,1,0,0
but seems to be,1,0,0
seems to be getting,1,0,0
to be getting lot,1,0,0
be getting lot of,1,0,0
getting lot of hype,1,0,0
lot of hype all,1,0,0
of hype all mine,1,0,0
hype all mine is,1,0,0
all mine is tied,1,0,0
mine is tied into,1,0,0
is tied into SGNL,1,0,0
tied into SGNL and,1,0,0
into SGNL and ONCY,1,0,0
SGNL and ONCY for,1,0,0
and ONCY for now,1,0,0
ONCY for now GL,1,0,0
Got nice push today,1,0,0
nice push today following,1,0,0
push today following small,1,0,0
today following small sweepers,1,0,0
following small sweepers of,1,0,0
small sweepers of May,1,0,0
sweepers of May this,1,0,0
of May this morning,1,0,0
Bary Port Unloaded Worth,0,0,1
Port Unloaded Worth of,0,0,1
Unloaded Worth of The,0,0,1
Worth of The Ensign,0,0,1
of The Ensign Group,0,0,1
The Ensign Group Inc,0,0,1
Ensign Group Inc NASDAQ,0,0,1
Group Inc NASDAQ ENSG,0,0,1
Inc NASDAQ ENSG Shares,0,0,1
NASDAQ ENSG Shares _url,0,0,1
by the end of,1,0,0
the end of the,1,0,0
end of the wek,1,0,0
of the wek did,1,0,0
the wek did you,1,0,0
wek did you snatch,1,0,0
did you snatch your,1,0,0
you snatch your If,1,0,0
snatch your If you,1,0,0
your If you blinked,1,0,0
If you blinked your,1,0,0
you blinked your eye,1,0,0
blinked your eye you,1,0,0
your eye you missed,1,0,0
eye you missed it,1,0,0
Hit With Lawsuit from,0,0,1
With Lawsuit from Russian,0,0,1
Lawsuit from Russian Search,0,0,1
from Russian Search Engine,0,0,1
Russian Search Engine _url,0,0,1
the regular scrappy usually,0,0,1
regular scrappy usually presents,0,0,1
scrappy usually presents Sales,0,0,1
usually presents Sales weak,0,0,1
presents Sales weak margins,0,0,1
Sales weak margins down,0,0,1
weak margins down debt,0,0,1
margins down debt still,0,0,1
down debt still way,0,0,1
debt still way up,0,0,1
up less then on,2,0,0
less then on the,2,0,0
then on the tape,2,0,0
on the tape do,2,0,0
the tape do not,2,0,0
tape do not know,2,0,0
do not know avg,2,0,0
not know avg vol,2,0,0
know avg vol so,2,0,0
avg vol so that,2,0,0
vol so that may,2,0,0
so that may be,2,0,0
that may be alot,2,0,0
may be alot for,2,0,0
be alot for the,2,0,0
alot for the stock,2,0,0
for the stock but,2,0,0
the stock but still,2,0,0
stock but still for,2,0,0
but still for every,2,0,0
bot at bot at,2,0,0
Bid for Reargument Denied,0,0,1
for Reargument Denied by,0,0,1
Reargument Denied by Judge,0,0,1
daily chart of with,1,0,0
chart of with upcoming,1,0,0
of with upcoming support,1,0,0
with upcoming support in,1,0,0
upcoming support in few,1,0,0
support in few days,1,0,0
in few days or,1,0,0
few days or weeks,1,0,0
days or weeks _url,1,0,0
Is Yahoo looking to,1,0,0
Yahoo looking to buy,1,0,0
looking to buy CN,1,0,0
to buy CN CBSNews,1,0,0
buy CN CBSNews january,1,0,0
CN CBSNews january _url,1,0,0
In response to your,0,0,1
response to your thoughts,0,0,1
to your thoughts on,0,0,1
your thoughts on about,0,0,1
thoughts on about Nikesh,0,0,1
on about Nikesh do,0,0,1
about Nikesh do not,0,0,1
Nikesh do not think,0,0,1
do not think is,0,0,1
not think is the,0,0,1
think is the right,0,0,1
is the right fit,0,0,1
the right fit for,0,0,1
right fit for visionary,0,0,1
fit for visionary aspects,0,0,1
weekly statistics finally starting,1,0,0
statistics finally starting to,1,0,0
finally starting to turn,1,0,0
starting to turn up,1,0,0
to turn up after,1,0,0
turn up after long,1,0,0
up after long consolidation,1,0,0
after long consolidation Buying,1,0,0
long consolidation Buying here,1,0,0
Very nice breakout on,1,0,0
nice breakout on very,1,0,0
breakout on very nice,1,0,0
on very nice stock,1,0,0
very nice stock _url,1,0,0
real losers today are,0,0,1
losers today are the,0,0,1
today are the Ms,0,0,1
are the Ms no,0,0,1
the Ms no Nasdaq,0,0,1
Ms no Nasdaq transactions,0,0,1
no Nasdaq transactions no,0,0,1
Nasdaq transactions no profit,0,0,1
transactions no profit for,0,0,1
no profit for them,0,0,1
profit for them sad,0,0,1
Vertex Monthly lower hi,1,0,0
Monthly lower hi lower,1,0,0
lower hi lower lo,1,0,0
hi lower lo Long,1,0,0
lower lo Long term,1,0,0
lo Long term trend,1,0,0
Long term trend intract,1,0,0
term trend intract so,1,0,0
trend intract so far,1,0,0
My broker has no,0,0,1
broker has no shorts,0,0,1
has no shorts who,0,0,1
no shorts who has,0,0,1
shorts who has them,0,0,1
trying to drag with,0,0,2
to drag with it,0,0,2
Will take swing trade,1,0,0
take swing trade profits,1,0,0
swing trade profits at,1,0,0
trade profits at leave,1,0,0
profits at leave core,1,0,0
at leave core position,1,0,0
leave core position for,1,0,0
core position for and,1,0,0
position for and target,1,0,0
for and target daytrade,1,0,0
and target daytrade buy,1,0,0
target daytrade buy zone,1,0,0
daytrade buy zone today,1,0,0
Free Net for Africa,1,0,0
Net for Africa _url,1,0,0
for Africa _url no,1,0,0
Africa _url no ROI,1,0,0
_url no ROI will,1,0,0
no ROI will piss,1,0,0
ROI will piss off,1,0,0
will piss off investors,1,0,0
piss off investors but,1,0,0
off investors but big,1,0,0
investors but big picture,1,0,0
but big picture is,1,0,0
big picture is BRILLIANT,1,0,0
picture is BRILLIANT Boy-wonder,1,0,0
is BRILLIANT Boy-wonder visionary,1,0,0
BRILLIANT Boy-wonder visionary Zuck,1,0,0
bounce right now has,1,0,0
right now has no,1,0,0
now has no vol,1,0,0
has no vol more,1,0,0
no vol more vol,1,0,0
vol more vol when,1,0,0
more vol when it,1,0,0
vol when it slid,1,0,0
another story stock with,0,0,1
story stock with an,0,0,1
stock with an unhappy,0,0,1
with an unhappy ending,0,0,1
an unhappy ending Typical,0,0,1
unhappy ending Typical Yeah,0,0,1
ending Typical Yeah Pretty,0,0,1
Typical Yeah Pretty much,0,0,1
Yeah Pretty much We,0,0,1
Pretty much We have,0,0,1
much We have seen,0,0,1
We have seen so,0,0,1
have seen so many,0,0,1
seen so many of,0,0,1
so many of these,0,0,1
today's top gainers _url,2,0,0
has had history of,0,0,1
had history of lack,0,0,1
history of lack of,0,0,1
of lack of PR,0,0,1
lack of PR shame,0,0,1
of PR shame for,0,0,1
PR shame for investors,0,0,1
Indexes industry groups track,3,0,0
industry groups track that,3,0,0
groups track that closed,3,0,0
track that closed Friday,3,0,0
that closed Friday with,3,0,0
closed Friday with the,3,0,0
Friday with the RS,3,0,0
with the RS line,3,0,0
the RS line in,3,0,0
RS line in new,3,0,0
line in new highs,3,0,0
Avago Broadcom To Combine,2,0,0
Broadcom To Combine In,2,0,0
To Combine In Billion,2,0,0
Combine In Billion Deal,2,0,0
In Billion Deal _url,2,0,0
Problem for shorts on,1,0,0
for shorts on Facebok,1,0,0
shorts on Facebok now,1,0,0
on Facebok now is,1,0,0
Facebok now is every,1,0,0
now is every fund,1,0,0
is every fund out,1,0,0
every fund out there,1,0,0
fund out there will,1,0,0
out there will want,1,0,0
there will want to,1,0,0
will want to buy,1,0,0
want to buy this,1,0,0
to buy this thing,1,0,0
buy this thing on,1,0,0
this thing on pullback,1,0,0
thing on pullback Not,1,0,0
on pullback Not good,1,0,0
pullback Not good anymore,1,0,0
want to see awesomely,1,0,0
to see awesomely bullish,1,0,0
see awesomely bullish stocks,1,0,0
awesomely bullish stocks Check,1,0,0
bullish stocks Check out,1,0,0
stocks Check out Europe,1,0,0
Check out Europe might,1,0,0
out Europe might mess,1,0,0
Europe might mess but,1,0,0
might mess but people,1,0,0
mess but people still,1,0,0
but people still shipping,1,0,0
people still shipping stuf,1,0,0
SOLD to close puts,0,0,2
to close puts for,0,0,2
close puts for SOLD,0,0,1
puts for SOLD to,0,0,1
for SOLD to close,0,0,1
close puts for loss,0,0,1
puts for loss Sorry,0,0,1
for loss Sorry for,0,0,1
loss Sorry for late,0,0,1
Sorry for late post,0,0,1
in the end DropBox,0,0,1
the end DropBox will,0,0,1
end DropBox will end,0,0,1
DropBox will end up,0,0,1
will end up selling,0,0,1
end up selling for,0,0,1
up selling for pennies,0,0,1
selling for pennies on,0,0,1
for pennies on the,0,0,1
pennies on the dollar,0,0,1
on the dollar Just,0,0,1
the dollar Just like,0,0,1
dollar Just like Box,0,0,1
Just like Box et,0,0,1
Book on Jobs makes,1,0,0
on Jobs makes news,1,0,0
Jobs makes news citing,1,0,0
makes news citing Steve,1,0,0
news citing Steve Jobs,1,0,0
citing Steve Jobs saying,1,0,0
Steve Jobs saying he,1,0,0
Jobs saying he cracked,1,0,0
saying he cracked the,1,0,0
he cracked the code,1,0,0
cracked the code on,1,0,0
the code on simplifying,1,0,0
code on simplifying integrating,1,0,0
on simplifying integrating TV,1,0,0
simplifying integrating TV with,1,0,0
integrating TV with cloud,1,0,0
TV with cloud Imagine,1,0,0
with cloud Imagine TV,1,0,0
cloud Imagine TV impact,1,0,0
Southwest Is at Its,1,0,0
Is at Its Lowest,1,0,0
at Its Lowest Multiple,1,0,0
Its Lowest Multiple Ever,1,0,0
Lowest Multiple Ever _url,1,0,0
Mute point if china,0,0,1
point if china hard,0,0,1
if china hard landing,0,0,1
china hard landing European,0,0,1
hard landing European bank,0,0,1
landing European bank collapse,0,0,1
European bank collapse american,0,0,1
bank collapse american double,0,0,1
collapse american double dip,0,0,1
american double dip apl,0,0,1
double dip apl will,0,0,1
dip apl will not,0,0,1
apl will not have,0,0,1
will not have anyone,0,0,1
not have anyone buying,0,0,1
have anyone buying products,0,0,1
more of artist myself,2,0,0
of artist myself news,2,0,0
artist myself news MM,2,0,0
myself news MM talk,2,0,0
news MM talk is,2,0,0
MM talk is orchestrated,2,0,0
talk is orchestrated BS,2,0,0
is orchestrated BS Long,2,0,0
orchestrated BS Long tech,2,0,0
BS Long tech for,2,0,0
Long tech for early,2,0,0
tech for early Jan,2,0,0
for early Jan after,2,0,0
early Jan after that,2,0,0
Jan after that it,2,0,0
after that it is,2,0,0
that it is straight,2,0,0
it is straight to,2,0,0
is straight to calls,2,0,0
Key price to watch,0,0,1
price to watch in,0,0,1
to watch in off,0,0,1
watch in off the,0,0,1
in off the previous,0,0,1
off the previous double,0,0,1
the previous double top,0,0,1
previous double top reject,0,0,1
double top reject _url,0,0,1
Added Cost now at,1,0,0
Cost now at Bounce,1,0,0
now at Bounce off,1,0,0
at Bounce off of,1,0,0
Bounce off of Put,1,0,0
off of Put OI,1,0,0
of Put OI pivot,1,0,0
Put OI pivot BTO,1,0,0
OI pivot BTO Apr,1,0,0
pivot BTO Apr Calls,1,0,0
BTO Apr Calls for,1,0,0
Apr Calls for ride,1,0,0
Calls for ride to,1,0,0
for ride to ish,1,0,0
PNC Goldman Sachs Receive,2,0,0
Goldman Sachs Receive Dividend,2,0,0
Sachs Receive Dividend Hike,2,0,0
Receive Dividend Hike Green,2,0,0
Dividend Hike Green Light,2,0,0
Hike Green Light But,2,0,0
Green Light But do,2,0,0
Light But do not,2,0,0
But do not Act,2,0,0
do not Act ):,2,0,0
not Act ): _url,2,0,0
am excited about all,2,0,0
excited about all these,2,0,0
about all these plays,2,0,0
Monday commodity weakness staple,0,0,1
commodity weakness staple in,0,0,1
weakness staple in right,0,0,1
staple in right along,0,0,1
in right along with,0,0,1
right along with the,0,0,1
along with the consumer,0,0,1
with the consumer smalcap,0,0,1
the consumer smalcap multiple,0,0,1
consumer smalcap multiple expansion,0,0,1
smalcap multiple expansion algo,0,0,1
had nice breakout of,1,0,0
nice breakout of the,1,0,0
breakout of the recent,1,0,0
of the recent consolidation,1,0,0
the recent consolidation Congrats,1,0,0
recent consolidation Congrats to,1,0,0
consolidation Congrats to those,1,0,0
Congrats to those who,1,0,0
to those who had,1,0,0
those who had it,1,0,0
who had it _url,1,0,0
sells flat am out,0,0,1
his pull back of,0,0,1
pull back of is,0,0,1
back of is similar,0,0,1
of is similar to,0,0,1
is similar to last,0,0,1
similar to last and,0,0,1
to last and bulish,0,0,1
last and bulish if,0,0,1
and bulish if LOD,0,0,1
bulish if LOD holds,0,0,1
In mostly red tape,1,0,0
mostly red tape this,1,0,0
red tape this morning,1,0,0
tape this morning biggest,1,0,0
this morning biggest gainers,1,0,0
morning biggest gainers are,1,0,0
Crude Oil Bears Take,0,0,3
Oil Bears Take Clear,0,0,3
Bears Take Clear Near,0,0,3
Take Clear Near Term,0,0,3
Clear Near Term Advantage,0,0,3
Near Term Advantage _url,0,0,3
Would short on any,0,0,1
short on any rally,0,0,1
Sell Short Position on,1,0,0
Short Position on CNP,1,0,0
Position on CNP Closed,1,0,0
on CNP Closed for,1,0,0
CNP Closed for Profit,1,0,0
Closed for Profit _url,1,0,0
they are usually cheap,0,0,1
are usually cheap for,0,0,1
usually cheap for reason,0,0,1
cheap for reason RT,0,0,1
for reason RT my,0,0,1
reason RT my dog,0,0,1
RT my dog of,0,0,1
my dog of the,0,0,1
dog of the last,0,0,1
of the last few,0,0,1
the last few months,0,0,1
last few months LF,0,0,1
few months LF damn,0,0,1
months LF damn me,0,0,1
LF damn me and,0,0,1
damn me and low,0,0,1
me and low priced,0,0,1
and low priced stocks,0,0,1
for to follow after,0,0,2
to follow after SELL,0,0,2
follow after SELL signal,0,0,2
after SELL signal by,0,0,2
SELL signal by internals,0,0,2
signal by internals technical,0,0,2
by internals technical SELL,0,0,2
internals technical SELL DOWN,0,0,2
period RSI is down,1,0,0
RSI is down at,1,0,0
is down at just,1,0,0
down at just read,1,0,0
at just read Connors,1,0,0
just read Connors book,1,0,0
read Connors book on,1,0,0
Connors book on trading,1,0,0
book on trading strategies,1,0,0
Published estimate on Estimize,1,0,0
estimate on Estimize EPS,1,0,0
on Estimize EPS and,1,0,0
Estimize EPS and Revs,1,0,0
EPS and Revs compared,1,0,0
and Revs compared to,1,0,0
Revs compared to Wall,1,0,0
compared to Wall Stret's,1,0,0
to Wall Stret's consensus,1,0,0
Wall Stret's consensus _url,1,0,0
Equity indexes working on,2,0,0
indexes working on positive,2,0,0
working on positive engulfing,2,0,0
on positive engulfing for,2,0,0
positive engulfing for March,2,0,0
engulfing for March Smal-caps,2,0,0
for March Smal-caps semis,2,0,0
March Smal-caps semis with,2,0,0
Smal-caps semis with fakeout,2,0,0
semis with fakeout before,2,0,0
with fakeout before the,2,0,0
fakeout before the out,2,0,0
slid to four-year low,0,0,1
to four-year low after,0,0,1
four-year low after kept,0,0,1
low after kept its,0,0,1
after kept its oil,0,0,1
kept its oil production,0,0,1
its oil production unchanged,0,0,1
oil production unchanged _url,0,0,1
green lol make-up to,1,0,0
lol make-up to cover,1,0,0
make-up to cover ugliness,1,0,0
to cover ugliness _url,1,0,0
cover ugliness _url <--,1,0,0
ugliness _url <-- RS,1,0,0
_url <-- RS yesterday,1,0,0
<-- RS yesterday BOOM,1,0,0
RS yesterday BOOM today,1,0,0
P E with negative,1,0,1
E with negative P,1,0,1
with negative P L,1,0,1
negative P L on,1,0,1
P L on hardware,1,0,1
L on hardware P,1,0,1
on hardware P E,1,0,1
hardware P E profitable,1,0,1
P E profitable hard,1,0,1
E profitable hard and,1,0,1
profitable hard and software,1,0,1
hard and software product,1,0,1
and software product innovator,1,0,1
sold my calls for,0,0,1
my calls for from,0,0,1
calls for from cents,0,0,1
for from cents averaged,0,0,1
from cents averaged pl,0,0,1
cents averaged pl is,0,0,1
averaged pl is saver,0,0,1
pl is saver for,0,0,1
is saver for my,0,0,1
saver for my last,0,0,1
for my last week,0,0,1
my last week losses,0,0,1
at resistance right here,0,0,1
resistance right here old,0,0,1
right here old my,0,0,1
here old my shares,0,0,1
old my shares il,0,0,1
my shares il buy,0,0,1
shares il buy back,0,0,1
il buy back if,0,0,1
buy back if it,0,0,1
back if it dips,0,0,1
if it dips or,0,0,1
it dips or if,0,0,1
dips or if it,0,0,1
or if it goes,0,0,1
if it goes in,0,0,1
it goes in the,0,0,1
goes in the gap,0,0,1
in the gap zone,0,0,1
Plan for rest of,2,0,0
for rest of week,2,0,0
rest of week Holding,2,0,0
of week Holding with,2,0,0
week Holding with stops,2,0,0
Holding with stops accumulating,2,0,0
with stops accumulating more,2,0,0
stops accumulating more on,2,0,0
accumulating more on any,2,0,0
more on any pulback,2,0,0
finally broke free from,1,0,0
broke free from big,1,0,0
free from big brother's,1,0,0
from big brother's shadow,1,0,0
like this Ascending Triangle,1,0,0
this Ascending Triangle on,1,0,0
Ascending Triangle on the,1,0,0
Triangle on the minute,1,0,0
on the minute chart,1,0,0
the minute chart Breakout,1,0,0
minute chart Breakout coming,1,0,0
chart Breakout coming Monday,1,0,0
Breakout coming Monday _url,1,0,0
coming Monday _url promising,1,0,0
time to accumulate for,1,0,0
to accumulate for long,1,0,0
accumulate for long position,1,0,0
for long position with,1,0,0
long position with far,1,0,0
position with far more,1,0,0
with far more upside,1,0,0
far more upside than,1,0,0
Nasdaq Sets Up for,2,0,0
Sets Up for Breakout,2,0,0
Up for Breakout Part,2,0,0
for Breakout Part II,2,0,0
Breakout Part II via,2,0,0
Part II via _url,2,0,0
Something big is going,0,1,0
big is going to,0,1,0
is going to happen,0,1,0
going to happen here,0,1,0
to happen here too,0,1,0
happen here too much,0,1,0
here too much pre,0,1,0
too much pre market,0,1,0
much pre market trading,0,1,0
pre market trading going,0,1,0
market trading going on,0,1,0
trading going on ep,0,1,0
going on ep EYES,0,1,0
on ep EYES open,0,1,0
haven seen vol like,0,0,1
seen vol like this,0,0,1
vol like this since,0,0,1
like this since the,0,0,1
this since the runup,0,0,1
since the runup let,0,0,1
the runup let us,0,0,1
runup let us see,0,0,1
let us see one,0,0,1
us see one more,0,0,1
see one more dip,0,0,1
one more dip to,0,0,1
hanging tough in down,1,0,0
tough in down market,1,0,0
in down market due,1,0,0
down market due to,1,0,0
market due to analyst,1,0,0
due to analyst upgrades,1,0,0
to analyst upgrades last,1,0,0
analyst upgrades last week,1,0,0
upgrades last week Up,1,0,0
last week Up almost,1,0,0
Coal stocks are poking,1,0,0
stocks are poking their,1,0,0
are poking their head,1,0,0
poking their head up,1,0,0
their head up Here's,1,0,0
head up Here's what,1,0,0
up Here's what was,1,0,0
Here's what was looking,1,0,0
what was looking at,1,0,0
was looking at earlier,1,0,0
looking at earlier this,1,0,0
at earlier this week,1,0,0
earlier this week _url,1,0,0
this week _url very,1,0,0
week _url very nice,1,0,0
_url very nice weekly,1,0,0
very nice weekly candle,1,0,0
Still holding my for,1,0,0
holding my for next,1,0,0
my for next year,1,0,0
IMO Fed stimulus of,1,0,0
Fed stimulus of any,1,0,0
stimulus of any kind,1,0,0
of any kind could,1,0,0
any kind could not,1,0,0
kind could not be,1,0,0
could not be defended,1,0,0
not be defended by,1,0,0
be defended by Obama,1,0,0
defended by Obama thus,1,0,0
by Obama thus is,1,0,0
Obama thus is exceptionally,1,0,0
thus is exceptionally bullish,1,0,0
is exceptionally bullish for,1,0,0
exceptionally bullish for Romney,1,0,0
bullish for Romney the,1,0,0
for Romney the mkt,1,0,0
Romney the mkt and,1,0,0
the mkt and the,1,0,0
mkt and the economy,1,0,0
AP Caterpillar posts percent,1,0,0
Caterpillar posts percent jump,1,0,0
posts percent jump in,1,0,0
percent jump in profit,1,0,0
jump in profit on,1,0,0
in profit on steep,1,0,0
profit on steep global,1,0,0
on steep global sales,1,0,0
steep global sales increase,1,0,0
global sales increase tops,1,0,0
sales increase tops Wall,1,0,0
increase tops Wall St,1,0,0
tops Wall St view,1,0,0
_url Loving BTU and,1,0,0
Loving BTU and the,1,0,0
BTU and the coal,1,0,0
and the coal stocks,1,0,0
the coal stocks in,1,0,0
coal stocks in here,1,0,0
stocks in here Even,1,0,0
in here Even WLT,1,0,0
here Even WLT too,1,0,0
what is more exciting,0,1,0
is more exciting this,0,1,0
more exciting this market,0,1,0
exciting this market or,0,1,0
this market or watching,0,1,0
market or watching paint,0,1,0
or watching paint dry,0,1,0
watching paint dry Typical,0,1,0
paint dry Typical of,0,1,0
dry Typical of the,0,1,0
Typical of the range,0,1,0
of the range market,0,1,0
the range market w,0,1,0
range market w low,0,1,0
market w low volatility,0,1,0
Fundamentally nothing has changed,1,0,0
nothing has changed and,1,0,0
has changed and this,1,0,0
changed and this company,1,0,0
and this company will,1,0,0
this company will make,1,0,0
company will make more,1,0,0
will make more profit,1,0,0
make more profit than,1,0,0
more profit than others,1,0,0
profit than others whether,1,0,0
than others whether the,1,0,0
others whether the stock,1,0,0
whether the stock price,1,0,0
the stock price is,1,0,0
stock price is or,1,0,0
NEW POST China Stares,0,0,2
POST China Stares Into,0,0,2
China Stares Into the,0,0,2
Stares Into the Abyss,0,0,2
Into the Abyss _url,0,0,2
Smartphone Wars Wound Samsung,1,0,0
Wars Wound Samsung as,1,0,0
Wound Samsung as Nokia,1,0,0
Samsung as Nokia Rallies,1,0,0
as Nokia Rallies Chart,1,0,0
Nokia Rallies Chart of,1,0,0
Rallies Chart of the,1,0,0
Chart of the Day,1,0,0
of the Day _url,1,0,0
How much are you,1,0,0
much are you short,1,0,0
are you short It,1,0,0
you short It is,1,0,0
short It is not,1,0,0
It is not High,1,0,0
is not High stock,1,0,0
not High stock and,1,0,0
High stock and CHINA,1,0,0
stock and CHINA is,1,0,0
and CHINA is where,1,0,0
CHINA is where the,1,0,0
is where the growth,1,0,0
where the growth is,1,0,0
the growth is Pay,1,0,0
growth is Pay attention,1,0,0
is Pay attention HERBIE,1,0,0
got bored and took,0,0,1
bored and took my,0,0,1
and took my proprietary,0,0,1
took my proprietary profit,0,0,1
my proprietary profit exit,0,0,1
proprietary profit exit did,0,0,1
profit exit did not,0,0,1
exit did not like,0,0,1
did not like the,0,0,1
not like the option,0,0,1
like the option liquidity,0,0,1
the option liquidity and,0,0,1
option liquidity and lousy,0,0,1
liquidity and lousy spreads,0,0,1
has gained an average,1,0,0
gained an average of,1,0,0
an average of week,1,0,0
average of week for,1,0,0
of week for the,1,0,0
week for the last,1,0,0
for the last nine,1,0,0
the last nine years,1,0,0
Rival companies and WATCO,1,0,0
companies and WATCO eyeing,1,0,0
and WATCO eyeing with,1,0,0
WATCO eyeing with take-over,1,0,0
eyeing with take-over interest,1,0,0
with take-over interest _url,1,0,0
JAPAN EARNINGS Of the,4,0,0
EARNINGS Of the of,4,0,0
Of the of Topix,4,0,0
the of Topix companies,4,0,0
of Topix companies that,4,0,0
