,pos,neutral,neg
Twitter during this dip,4,0,0
during this dip more,4,0,0
this dip more _url,4,0,0
Unusual call buying average,4,0,0
call buying average volume,4,0,0
Insiders Are Selling Facebok,0,0,6
Are Selling Facebok and,0,0,6
Selling Facebok and Ford,0,0,6
Facebok and Ford Motor,0,0,6
and Ford Motor _url,0,0,6
if breaks we see,0,0,1
breaks we see then,0,0,1
on the fence with,0,1,0
the fence with this,0,1,0
fence with this one,0,1,0
with this one Do,0,1,0
this one Do have,0,1,0
one Do have time,0,1,0
Do have time to,0,1,0
have time to dither,0,1,0
time to dither _url,0,1,0
Unusual Call Activity _url,4,0,0
Watching Higher lower and,3,0,4
Higher lower and maybe,3,0,4
lower and maybe fade,3,0,4
and maybe fade the,3,0,4
maybe fade the metals,3,0,4
fade the metals gap,3,0,4
Rae Chipera placed an,0,0,1
Chipera placed an order,0,0,1
placed an order to,0,0,1
an order to sell,0,0,1
order to sell shares,0,0,1
to sell shares of,0,0,1
sell shares of Apple,0,0,1
shares of Apple Inc,0,0,1
of Apple Inc _url,0,0,1
Short Setups Looking Nice,0,0,8
Setups Looking Nice Realy,0,0,8
Looking Nice Realy Nice,0,0,8
Nice Realy Nice _url,0,0,8
Stocks am watching and,3,0,0
am watching and buy,3,0,0
watching and buy targets,3,0,0
and buy targets ):,3,0,0
beats the Estimize EPS,1,0,0
the Estimize EPS Consensus,1,0,0
Estimize EPS Consensus by,1,0,0
EPS Consensus by and,1,0,0
Consensus by and the,1,0,0
by and the Estimize,1,0,0
and the Estimize Revenue,1,0,0
the Estimize Revenue Consensus,1,0,0
Estimize Revenue Consensus by,1,0,0
Revenue Consensus by _url,1,0,0
outperforms after CNBC column,1,2,0
after CNBC column highlights,1,2,0
CNBC column highlights Google,1,2,0
column highlights Google data,1,2,0
highlights Google data provides,1,2,0
Google data provides favorable,1,2,0
data provides favorable Citron,1,2,0
provides favorable Citron quote,1,2,0
favorable Citron quote _url,1,2,0
OMG YAS YAS YAS,0,0,1
YAS YAS YAS _url,0,0,1
YAS YAS _url UR,0,0,1
YAS _url UR COVER,0,0,1
_url UR COVER OF,0,0,1
UR COVER OF PILOWTALK,0,0,1
COVER OF PILOWTALK IS,0,0,1
OF PILOWTALK IS PERF,0,0,1
PILOWTALK IS PERF 😍,0,0,1
IS PERF 😍 😍,0,0,1
PERF 😍 😍 😍,0,0,1
Looking for sales curious,4,0,0
for sales curious about,4,0,0
sales curious about drop,4,0,0
curious about drop among,4,0,0
about drop among few,4,0,0
drop among few other,4,0,0
among few other _url,4,0,0
it is great step,1,0,0
is great step for,1,0,0
great step for to,1,0,0
step for to let,1,0,0
for to let in,1,0,0
to let in Hope,1,0,0
let in Hope China,1,0,0
in Hope China unlock,1,0,0
Hope China unlock soon,1,0,0
China unlock soon China,1,0,0
unlock soon China government,1,0,0
soon China government has,1,0,0
China government has done,1,0,0
government has done wonderful,1,0,0
has done wonderful job,1,0,0
done wonderful job _url,1,0,0
Highest call to put,7,0,0
call to put ratio,7,0,0
to put ratio _url,7,0,0
There was news this,1,0,0
was news this morning,1,0,0
news this morning that,1,0,0
this morning that offers,1,0,0
morning that offers will,1,0,0
that offers will take,1,0,0
offers will take place,1,0,0
will take place until,1,0,0
take place until next,1,0,0
place until next wek,1,0,0
until next wek so,1,0,0
next wek so if,1,0,0
wek so if people,1,0,0
so if people want,1,0,0
if people want to,1,0,0
people want to buy,1,0,0
want to buy they,1,0,0
to buy they should,1,0,0
buy they should do,1,0,0
they should do it,1,0,0
should do it now,1,0,0
you airlines battle for,3,0,0
airlines battle for Cuba,3,0,0
battle for Cuba routes,3,0,0
for Cuba routes _url,3,0,0
What move from in,1,0,0
move from in Feb,1,0,0
from in Feb Headed,1,0,0
in Feb Headed to,1,0,0
Feb Headed to all,1,0,0
Headed to all time,1,0,0
all time highs is,1,0,0
time highs is some,1,0,0
highs is some unforeseen,1,0,0
is some unforeseen safety,1,0,0
some unforeseen safety issue,1,0,0
unforeseen safety issue with,1,0,0
safety issue with devices,1,0,0
rejected that to the,0,0,1
that to the penny,0,0,1
to the penny Weak,0,0,1
the penny Weak open,0,0,1
penny Weak open and,0,0,1
Weak open and it,0,0,1
open and it goes,0,0,1
and it goes r,0,0,1
it goes r g,0,0,1
goes r g within,0,0,1
r g within mins,0,0,1
g within mins could,0,0,1
within mins could have,0,0,1
mins could have points,0,0,1
could have points in,0,0,1
have points in it,0,0,1
points in it _url,0,0,1
peachy prospects Why the,1,0,0
prospects Why the maker,1,0,0
Why the maker is,1,0,0
the maker is worth,1,0,0
maker is worth share,1,0,0
is worth share _url,1,0,0
worth share _url _url,1,0,0
Nice day rally _url,11,0,0
Closed Buy Lots for,3,0,0
Buy Lots for pips,3,0,0
Lots for pips total,3,0,0
for pips total for,3,0,0
pips total for today,3,0,0
total for today pips,3,0,0
for today pips Visit,3,0,0
today pips Visit _url,3,0,0
pips Visit _url for,3,0,0
Visit _url for more,3,0,0
_url for more trades,3,0,0
cuts outlook down Could,0,0,1
outlook down Could see,0,0,1
down Could see fall,0,0,1
Could see fall in,0,0,1
see fall in sympathy,0,0,1
weakness continues again area,0,0,1
continues again area resistance,0,0,1
again area resistance after,0,0,1
area resistance after last,0,0,1
resistance after last week,0,0,1
TV Côte d'ivoire Vers,1,0,0
Côte d'ivoire Vers une,1,0,0
d'ivoire Vers une réforme,1,0,0
Vers une réforme de,1,0,0
une réforme de la,1,0,0
réforme de la constitution,1,0,0
de la constitution _url,1,0,0
maybe or Bad governance,0,0,2
or Bad governance not,0,0,2
Bad governance not confident,0,0,2
governance not confident in,0,0,2
not confident in core,0,0,2
confident in core business,0,0,2
inst ownership of actually,2,1,0
ownership of actually is,2,1,0
of actually is not,2,1,0
actually is not egregious,2,1,0
is not egregious anyways,2,1,0
not egregious anyways all,2,1,0
egregious anyways all higher,2,1,0
have no idea what,1,0,0
no idea what is,1,0,0
idea what is being,1,0,0
what is being debated,1,0,0
is being debated but,1,0,0
being debated but this,1,0,0
debated but this is,1,0,0
but this is great,1,0,0
this is great fun,1,0,0
is great fun actually,1,0,0
great fun actually _url,1,0,0
Wondering if and will,2,0,0
if and will catch,2,0,0
and will catch bid,2,0,0
will catch bid today,2,0,0
catch bid today on,2,0,0
bid today on news,2,0,0
today on news Sector,2,0,0
on news Sector has,2,0,0
news Sector has been,2,0,0
Sector has been taking,2,0,0
has been taking beating,2,0,0
been taking beating recently,2,0,0
taking beating recently could,2,0,0
beating recently could be,2,0,0
recently could be positive,2,0,0
could be positive here,2,0,0
Followed the levels shared,3,0,0
the levels shared with,3,0,0
levels shared with you,3,0,0
shared with you on,3,0,0
with you on calls,3,0,0
you on calls for,3,0,0
on calls for nice,3,0,0
calls for nice gains,3,0,0
for nice gains Still,3,0,0
nice gains Still holding,3,0,0
gains Still holding calls,3,0,0
Still holding calls Week,3,0,0
holding calls Week made,3,0,0
calls Week made in,3,0,0
Week made in morning,3,0,0
Sunday watchlist entry from,1,0,0
watchlist entry from MON,1,0,0
entry from MON and,1,0,0
from MON and going,1,0,0
MON and going now,1,0,0
and going now someone,1,0,0
going now someone bought,1,0,0
now someone bought lots,1,0,0
someone bought lots of,1,0,0
bought lots of calls,1,0,0
lots of calls MON,1,0,0
of calls MON _url,1,0,0
Nice names on watch,0,1,2
names on watch for,0,1,2
on watch for tomorrow,0,1,2
watch for tomorrow long,0,1,2
for tomorrow long short,0,1,2
tomorrow long short potential,0,1,2
long short potential r,0,1,2
short potential r g,0,1,2
potential r g and,0,1,2
r g and short,0,1,2
g and short under,0,1,2
Oil To Break Out,4,0,0
To Break Out Adding,4,0,0
Break Out Adding Chevron,4,0,0
Out Adding Chevron _url,4,0,0
Top for March _url,5,0,0
strong tech leads DOW,1,0,0
tech leads DOW higher,1,0,0
new long IF is,4,0,0
long IF is broken,4,0,0
IF is broken Targets,4,0,0
is broken Targets are,4,0,0
broken Targets are Bears,4,0,0
Targets are Bears must,4,0,0
are Bears must retake,4,0,0
Bears must retake _url,4,0,0
over million new Internet,5,0,0
million new Internet users,5,0,0
new Internet users are,5,0,0
Internet users are being,5,0,0
users are being added,5,0,0
are being added globally,5,0,0
being added globally every,5,0,0
added globally every year,5,0,0
globally every year _url,5,0,0
Baird likes upgrades to,1,0,0
likes upgrades to outperform,1,0,0
upgrades to outperform lifts,1,0,0
to outperform lifts price,1,0,0
outperform lifts price target,1,0,0
lifts price target to,1,0,0
price target to Research,1,0,0
target to Research firm,1,0,0
to Research firm also,1,0,0
Research firm also sees,1,0,0
firm also sees no,1,0,0
also sees no capital,1,0,0
sees no capital raise,1,0,0
no capital raise necessary,1,0,0
capital raise necessary in,1,0,0
raise necessary in next,1,0,0
necessary in next few,1,0,0
in next few qtrs,1,0,0
patents system that uses,1,0,0
system that uses selfies,1,0,0
that uses selfies and,1,0,0
uses selfies and blinking,1,0,0
selfies and blinking to,1,0,0
and blinking to pay,1,0,0
blinking to pay online,1,0,0
to pay online Daily,1,0,0
pay online Daily Mail,1,0,0
online Daily Mail Online,1,0,0
Daily Mail Online _url,1,0,0
Markets Back in Black,3,0,0
Back in Black for,3,0,0
in Black for _url,3,0,0
Black for _url _url,3,0,0
already have and adding,2,0,0
have and adding and,2,0,0
and adding and to,2,0,0
adding and to the,2,0,0
and to the mix,2,0,0
to the mix soon,2,0,0
would not feel terribly,0,0,1
not feel terribly good,0,0,1
feel terribly good about,0,0,1
terribly good about recent,0,0,1
good about recent order,0,0,1
about recent order for,0,0,1
recent order for with,0,0,1
order for with today's,0,0,1
for with today's recall,0,0,1
now up w div,2,0,0
up w div since,2,0,0
w div since my,2,0,0
div since my original,2,0,0
since my original call,2,0,0
my original call while,2,0,0
original call while up,2,0,0
call while up only,2,0,0
while up only even,2,0,0
up only even with,2,0,0
only even with this,2,0,0
even with this Fri's,2,0,0
with this Fri's div,2,0,0
this Fri's div be,2,0,0
Fri's div be damned,2,0,0
div be damned Still,2,0,0
be damned Still holding,2,0,0
Evercore ISI Ross Muken,1,0,0
ISI Ross Muken revised,1,0,0
Ross Muken revised targets,1,0,0
Muken revised targets ICON,1,0,0
revised targets ICON to,1,0,0
targets ICON to from,1,0,0
ICON to from Ilumina,1,0,0
to from Ilumina from,1,0,0
from Ilumina from Metler-Toledo,1,0,0
Ilumina from Metler-Toledo from,1,0,0
Notable gainers among liquid,3,0,0
gainers among liquid option,3,0,0
among liquid option names,3,0,0
liquid option names this,3,0,0
option names this morning,3,0,0
names this morning include,3,0,0
this morning include and,3,0,0
with the skinny on,1,0,0
the skinny on why,1,0,0
skinny on why iPhone,1,0,0
on why iPhone is,1,0,0
why iPhone is still,1,0,0
iPhone is still better,1,0,0
is still better than,1,0,0
still better than Galaxy,1,0,0
better than Galaxy _url,1,0,0
than Galaxy _url _url,1,0,0
Facebok is succeeding where,1,0,0
is succeeding where Google,1,0,0
succeeding where Google should,1,0,0
where Google should have,1,0,0
Google should have dominated,1,0,0
should have dominated _url,1,0,0
Good Morning Here's some,7,0,0
Morning Here's some of,7,0,0
Here's some of the,7,0,0
some of the most,7,0,0
of the most trending,7,0,0
the most trending among,7,0,0
most trending among this,7,0,0
trending among this morning,7,0,0
still they are saying,0,0,1
they are saying bullish,0,0,1
are saying bullish LoL,0,0,1
saying bullish LoL _url,0,0,1
Biotech's have had wks,2,0,0
have had wks of,2,0,0
had wks of fund,2,0,0
wks of fund flows,2,0,0
of fund flows for,2,0,0
fund flows for the,2,0,0
flows for the time,2,0,0
the time in graph,2,0,0
time in graph _url,2,0,0
Walgrens Boots Aliance uses,1,0,0
Boots Aliance uses warrants,1,0,0
Aliance uses warrants to,1,0,0
uses warrants to buy,1,0,0
warrants to buy of,1,0,0
to buy of AmerisourceBergen,1,0,0
buy of AmerisourceBergen shares,1,0,0
of AmerisourceBergen shares _url,1,0,0
If you are laughing,1,0,0
you are laughing at,1,0,0
are laughing at logistic,1,0,0
laughing at logistic provider,1,0,0
at logistic provider ambitions,1,0,0
logistic provider ambitions you,1,0,0
provider ambitions you are,1,0,0
ambitions you are damn,1,0,0
you are damn fool,1,0,0
are damn fool Not,1,0,0
damn fool Not every,1,0,0
fool Not every idea,1,0,0
Not every idea has,1,0,0
every idea has is,1,0,0
idea has is bad,1,0,0
Agree the valuation is,0,0,1
the valuation is high,0,0,1
valuation is high No,0,0,1
is high No net,0,0,1
high No net cash,0,0,1
No net cash forward,0,0,1
net cash forward growth,0,0,1
cash forward growth high,0,0,1
forward growth high peg,0,0,1
growth high peg historical,0,0,1
high peg historical high,0,0,1
peg historical high pe,0,0,1
historical high pe forward,0,0,1
high pe forward PE,0,0,1
Model Recall Adds To,0,0,1
Recall Adds To Reliability,0,0,1
Adds To Reliability Issues,0,0,1
To Reliability Issues _url,0,0,1
LVMH affordable doing just,2,0,0
affordable doing just fine,2,0,0
doing just fine helped,2,0,0
just fine helped by,2,0,0
fine helped by duty-free,2,0,0
helped by duty-free confident,2,0,0
by duty-free confident mainstream,2,0,0
duty-free confident mainstream shoppers,2,0,0
confident mainstream shoppers Booze,2,0,0
mainstream shoppers Booze strong,2,0,0
shoppers Booze strong beauty,2,0,0
Booze strong beauty flying,2,0,0
strong beauty flying at,2,0,0
Trying to break daily,1,0,0
to break daily trend,1,0,0
break daily trend line,1,0,0
daily trend line Big,1,0,0
trend line Big move,1,0,0
line Big move could,1,0,0
Big move could happen,1,0,0
move could happen _url,1,0,0
could happen _url _url,1,0,0
Facebok near buy point,2,0,0
near buy point last,2,0,0
buy point last week,2,0,0
point last week faces,2,0,0
last week faces different,2,0,0
week faces different technical,2,0,0
faces different technical test,2,0,0
different technical test today,2,0,0
technical test today _url,2,0,0
test today _url _url,2,0,0
Sector Stocks Leading Today,9,0,0
Stocks Leading Today _url,9,0,0
Tesla to recall Model,0,0,1
to recall Model SUVs,0,0,1
recall Model SUVs over,0,0,1
Model SUVs over seat,0,0,1
SUVs over seat issue,0,0,1
over seat issue _url,0,0,1
seat issue _url _url,0,0,1
issue _url _url _url,0,0,1
Worst for at market,0,0,2
for at market close,0,0,2
Tesla is recalling Model,0,0,1
is recalling Model cars,0,0,1
recalling Model cars _url,0,0,1
moves up little more,1,0,0
up little more today,1,0,0
little more today off,1,0,0
more today off of,1,0,0
today off of cup,1,0,0
off of cup and,1,0,0
of cup and handle,1,0,0
cup and handle _url,1,0,0
Amazing how at market,0,0,1
how at market cap,0,0,1
at market cap makes,0,0,1
market cap makes less,0,0,1
cap makes less profit,0,0,1
makes less profit than,0,0,1
less profit than the,0,0,1
profit than the sales,0,0,1
than the sales of,0,0,1
the sales of Watch,0,0,1
sales of Watch Where,0,0,1
of Watch Where is,0,0,1
Watch Where is the,0,0,1
Where is the valuation,0,0,1
is the valuation for,0,0,1
the valuation for apple,0,0,1
valuation for apple watch,0,0,1
for apple watch business,0,0,1
Facebok is suddenly realizing,0,0,1
is suddenly realizing SnR,0,0,1
suddenly realizing SnR is,0,0,1
realizing SnR is problem,0,0,1
SnR is problem in,0,0,1
is problem in newsfeds,0,0,1
problem in newsfeds Took,0,0,1
in newsfeds Took yeah,0,0,1
newsfeds Took yeah long,0,0,1
Took yeah long enough,0,0,1
If anyone is seling,2,0,0
anyone is seling shorting,2,0,0
is seling shorting because,2,0,0
seling shorting because you,2,0,0
shorting because you believe,2,0,0
because you believe rumors,2,0,0
you believe rumors to,2,0,0
believe rumors to be,2,0,0
rumors to be realistic,2,0,0
to be realistic then,2,0,0
be realistic then will,2,0,0
realistic then will take,2,0,0
then will take the,2,0,0
will take the other,2,0,0
take the other side,2,0,0
the other side of,2,0,0
other side of that,2,0,0
side of that trade,2,0,0
FINAL TRADES Pete Najarian,2,0,1
TRADES Pete Najarian —,2,0,1
Pete Najarian — sell,2,0,1
Najarian — sell Brian,2,0,1
— sell Brian Kelly,2,0,1
sell Brian Kelly —,2,0,1
Brian Kelly — sell,2,0,1
Kelly — sell Karen,2,0,1
— sell Karen Finerman,2,0,1
sell Karen Finerman —,2,0,1
Karen Finerman — buy,2,0,1
Finerman — buy Guy,2,0,1
— buy Guy Adami,2,0,1
buy Guy Adami —,2,0,1
Guy Adami — buy,2,0,1
So people thk is,1,0,0
people thk is failure,1,0,0
thk is failure cos,1,0,0
is failure cos it,1,0,0
failure cos it has,1,0,0
cos it has just,1,0,0
it has just of,1,0,0
has just of the,1,0,0
just of the users,1,0,0
of the users has,1,0,0
the users has they,1,0,0
users has they are,1,0,0
has they are forgetting,1,0,0
they are forgetting the,1,0,0
are forgetting the potential,1,0,0
forgetting the potential relative,1,0,0
the potential relative value,1,0,0
potential relative value of,1,0,0
relative value of its,1,0,0
value of its users,1,0,0
Reasons for caution about,0,0,2
for caution about Chinese,0,0,2
caution about Chinese stocks,0,0,2
about Chinese stocks _url,0,0,2
Jason pass for me,0,0,1
pass for me nt,0,0,1
for me nt done,0,0,1
me nt done good,0,0,1
nt done good with,0,0,1
done good with that,0,0,1
good with that name,0,0,1
with that name so,0,0,1
that name so will,0,0,1
name so will pass,0,0,1
so will pass it,0,0,1
will pass it focus,0,0,1
pass it focus on,0,0,1
it focus on ES,0,0,1
focus on ES SPY,0,0,1
on ES SPY today,0,0,1
ES SPY today on,0,0,1
SPY today on FOMC,0,0,1
today on FOMC and,0,0,1
on FOMC and long,0,0,1
FOMC and long CL,0,0,1
and long CL as,0,0,1
long CL as well,0,0,1
recalls Model cars Stock,0,0,1
Model cars Stock dropping,0,0,1
cars Stock dropping hard,0,0,1
Stock dropping hard hard,0,0,1
dropping hard hard .,0,0,1
Recal will not impact,1,0,0
will not impact financial,1,0,0
not impact financial results,1,0,0
impact financial results Excel,1,0,0
financial results Excel nonGAP,1,0,0
results Excel nonGAP spreadsheet,1,0,0
Excel nonGAP spreadsheet to,1,0,0
nonGAP spreadsheet to make,1,0,0
spreadsheet to make sure,1,0,0
to make sure of,1,0,0
make sure of that,1,0,0
Imperial ambitions The Economist,1,0,0
ambitions The Economist _url,1,0,0
Long on b o,1,0,0
on b o rumor,1,0,0
iPhone shipments on track,1,0,0
shipments on track to,1,0,0
on track to exceed,1,0,0
track to exceed forecasts,1,0,0
to exceed forecasts MarketWatch,1,0,0
exceed forecasts MarketWatch _url,1,0,0
Stockwhisperer quarter is amazing,3,0,0
On looking for sharp,2,0,0
looking for sharp move,2,0,0
for sharp move up,2,0,0
sharp move up in,2,0,0
move up in equities,2,0,0
up in equities seeing,2,0,0
in equities seeing getting,2,0,0
equities seeing getting hammered,2,0,0
seeing getting hammered even,2,0,0
getting hammered even though,2,0,0
hammered even though market,2,0,0
even though market is,2,0,0
though market is down,2,0,0
Report Apple signs up,2,0,2
Apple signs up for,2,0,2
signs up for Gogle's,2,0,2
up for Gogle's cloud,2,0,2
for Gogle's cloud uses,2,0,2
Gogle's cloud uses much,2,0,2
cloud uses much less,2,0,2
uses much less of,2,0,2
much less of Amazon's,2,0,2
less of Amazon's _url,2,0,2
Covered Call Alerts for,2,0,0
Call Alerts for from,2,0,0
Alerts for from InvestorsObserver,2,0,0
for from InvestorsObserver today,2,0,0
from InvestorsObserver today _url,2,0,0
Long at with stop,5,0,0
at with stop los,5,0,0
with stop los below,5,0,0
stop los below of,5,0,0
los below of buying,5,0,0
below of buying point,5,0,0
have been picking up,2,0,0
been picking up railroad,2,0,0
picking up railroad stocks,2,0,0
up railroad stocks for,2,0,0
railroad stocks for the,2,0,0
stocks for the retirement,2,0,0
for the retirement act,2,0,0
the retirement act down,2,0,0
retirement act down in,2,0,0
act down in last,2,0,0
down in last months,2,0,0
Going back in but,1,0,0
back in but slowly,1,0,0
in but slowly alert,1,0,0
but slowly alert example,1,0,0
slowly alert example GLB,1,0,0
alert example GLB _url,1,0,0
example GLB _url _url,1,0,0
Interest Heats Up for,1,0,0
Heats Up for The,1,0,0
Up for The Wall,1,0,0
for The Wall Street,1,0,0
The Wall Street Journal,1,0,0
Wall Street Journal _url,1,0,0
Apparently Intel thinks women,1,0,0
Intel thinks women should,1,0,0
thinks women should get,1,0,0
women should get paid,1,0,0
should get paid the,1,0,0
get paid the same,1,0,0
paid the same as,1,0,0
the same as men,1,0,0
same as men what,1,0,0
as men what concept,1,0,0
men what concept Gender,1,0,0
what concept Gender Pay,1,0,0
concept Gender Pay Parity,1,0,0
Gender Pay Parity at,1,0,0
Pay Parity at _url,1,0,0
The Three Top Stocks,2,0,0
Three Top Stocks in,2,0,0
Top Stocks in are,2,0,0
Stocks in are Ready,2,0,0
in are Ready to,2,0,0
are Ready to Lead,2,0,0
Ready to Lead Again,2,0,0
to Lead Again in,2,0,0
Lead Again in details,2,0,0
Again in details _url,2,0,0
Breakout watch for TUES,2,0,0
Court tells states to,1,0,0
tells states to leave,1,0,0
states to leave alone,1,0,0
to leave alone _url,1,0,0
leave alone _url via,1,0,0
just broke resistance watching,1,0,0
broke resistance watching for,1,0,0
resistance watching for right,1,0,0
watching for right out,1,0,0
for right out of,1,0,0
right out of the,1,0,0
out of the gate,1,0,0
of the gate tomorrow,1,0,0
the gate tomorrow morning,1,0,0
gate tomorrow morning _url,1,0,0
Break-out through DMA upper,1,0,0
through DMA upper head,1,0,0
DMA upper head res,1,0,0
upper head res Short,1,0,0
head res Short squeeze,1,0,0
res Short squeeze in,1,0,0
Short squeeze in progress,1,0,0
squeeze in progress Nr,1,0,0
in progress Nr term,1,0,0
progress Nr term obj,1,0,0
Nr term obj Stop,1,0,0
term obj Stop los,1,0,0
provider Cachet Financial Solutions,1,0,0
Cachet Financial Solutions Surging,1,0,0
Financial Solutions Surging Forward,1,0,0
Solutions Surging Forward today,1,0,0
Surging Forward today post,1,0,0
Forward today post earnings,1,0,0
today post earnings Up,1,0,0
post earnings Up _url,1,0,0
lots of green on,1,0,0
of green on the,1,0,0
green on the min,1,0,0
on the min watch,1,0,0
the min watch the,1,0,0
min watch the hourly,1,0,0
watch the hourly possible,1,0,0
the hourly possible resistance,1,0,0
hourly possible resistance currently,1,0,0
Isolationism Another Sell Rating,0,0,2
Another Sell Rating Sell,0,0,2
Sell Rating Sell Ratings,0,0,2
Rating Sell Ratings On,0,0,2
Sell Ratings On SPY,0,0,2
Ratings On SPY QQ,0,0,2
On SPY QQ IWM,0,0,2
SPY QQ IWM And,0,0,2
QQ IWM And Several,0,0,2
IWM And Several Companies,0,0,2
And Several Companies _url,0,0,2
Buy these stocks while,3,0,0
these stocks while there,3,0,0
stocks while there is,3,0,0
while there is blood,3,0,0
there is blood in,3,0,0
is blood in the,3,0,0
blood in the streets,3,0,0
in the streets _url,3,0,0
the streets _url _url,3,0,0
Goldman Sachs reiterates conviction,3,0,0
Sachs reiterates conviction buy,3,0,0
reiterates conviction buy on,3,0,0
conviction buy on Apple,3,0,0
buy on Apple with,3,0,0
on Apple with PT,3,0,0
Apple with PT _url,3,0,0
okay will make play,2,0,0
will make play for,2,0,0
make play for ER,2,0,0
play for ER it,2,0,0
for ER it is,2,0,0
ER it is gamble,2,0,0
it is gamble Will,2,0,0
is gamble Will be,2,0,0
gamble Will be adding,2,0,0
Will be adding on,2,0,0
be adding on dips,2,0,0
dropping of market cap,0,0,1
of market cap because,0,0,1
market cap because they,0,0,1
cap because they are,0,0,1
because they are losing,0,0,1
they are losing of,0,0,1
are losing of business,0,0,1
losing of business may,0,0,1
of business may be,0,0,1
business may be just,0,0,1
may be just tad,0,0,1
be just tad bit,0,0,1
just tad bit of,0,0,1
tad bit of an,0,0,1
bit of an overreaction,0,0,1
downgraded to neutral at,0,0,1
to neutral at Deutsche,0,0,1
neutral at Deutsche Bank,0,0,1
at Deutsche Bank Price,0,0,1
Deutsche Bank Price target,0,0,1
Bank Price target reduced,0,0,1
Price target reduced to,0,0,1
target reduced to from,0,0,1
Five Stocks that Helped,3,0,0
Stocks that Helped Starboard,3,0,0
that Helped Starboard Value,3,0,0
Helped Starboard Value ’,3,0,0
Starboard Value ’ s,3,0,0
Value ’ s Equity,3,0,0
’ s Equity Portfolio,3,0,0
s Equity Portfolio Return,3,0,0
Equity Portfolio Return in,3,0,0
Portfolio Return in _url,3,0,0
revenue Mark Zuckerberg is,1,0,0
Mark Zuckerberg is doing,1,0,0
Zuckerberg is doing an,1,0,0
is doing an amazing,1,0,0
doing an amazing job,1,0,0
an amazing job عوائد,1,0,0
amazing job عوائد فيسبوك,1,0,0
job عوائد فيسبوك التاريخية,1,0,0
عوائد فيسبوك التاريخية والمتوقعة,1,0,0
فيسبوك التاريخية والمتوقعة حتى,1,0,0
التاريخية والمتوقعة حتى _url,1,0,0
peaks above HOD hat,1,0,0
above HOD hat will,1,0,0
HOD hat will the,1,0,0
hat will the buy,1,0,0
will the buy out,1,0,0
the buy out look,1,0,0
buy out look like,1,0,0
looks pretty bullish for,1,0,0
pretty bullish for now,1,0,0
bullish for now from,1,0,0
for now from short-term,1,0,0
now from short-term perspective,1,0,0
from short-term perspective it,1,0,0
short-term perspective it is,1,0,0
perspective it is got,1,0,0
it is got good,1,0,0
is got good chance,1,0,0
got good chance of,1,0,0
good chance of maybe,1,0,0
chance of maybe sliding,1,0,0
of maybe sliding back,1,0,0
maybe sliding back to,1,0,0
looks really interesting on,1,0,0
really interesting on drop,1,0,0
interesting on drop grabbed,1,0,0
on drop grabbed some,1,0,0
drop grabbed some options,1,0,0
grabbed some options and,1,0,0
some options and stock,1,0,0
options and stock enough,1,0,0
and stock enough tme,1,0,0
stock enough tme before,1,0,0
enough tme before earnings,1,0,0
tme before earnings to,1,0,0
before earnings to grow,1,0,0
earnings to grow the,1,0,0
to grow the stock,1,0,0
grow the stock growth,1,0,0
the stock growth all,1,0,0
stock growth all sectors,1,0,0
looking sexy this morning,1,0,0
sexy this morning break,1,0,0
this morning break on,1,0,0
morning break on volume,1,0,0
break on volume and,1,0,0
on volume and it,1,0,0
volume and it is,1,0,0
and it is gone,1,0,0
Whole Foods shareholders vote,0,0,1
Foods shareholders vote down,0,0,1
shareholders vote down activist,0,0,1
vote down activist initiatives,0,0,1
down activist initiatives _url,0,0,1
Today bought more _url,5,0,0
stock has not moved,1,0,0
has not moved much,1,0,0
